<?xml version="1.0" encoding="UTF-8"?>
<!DOCTYPE student [
    <!ELEMENT student (id, name, class, university)>
    <!ELEMENT id (#PCDATA)>
    <!ELEMENT name (#PCDATA)>
    <!ELEMENT class (#PCDATA)>
    <!ELEMENT university (#PCDATA)>
]>

<student> 
    <id>20162431</id>
    <name>Linh Nguyen</name>
    <class>ICT.02</class>
    <university>Ha Noi University of science and technology</university>
</student> 